{
  "collected_at": "2026-04-21T12:34:26+08:00",
  "source": "github-search",
  "version": "1.0",
  "items": [
    {
      "title": "openclaw",
      "url": "https://github.com/openclaw/openclaw",
      "popularity": 361358,
      "popularity_type": "total_stars",
      "author": "openclaw",
      "created_at": "2025-11-24T18:16:47+08:00",
      "updated_at": "2026-04-21T12:33:39+08:00",
      "language": "TypeScript",
      "topics": [
        "ai",
        "assistant",
        "crustacean",
        "molty",
        "openclaw",
        "own-your-data",
        "personal"
      ],
      "summary": "用户想要一份关于“openclaw”的50-200字的项目摘要，基于提供的信息，重点介绍其功能和特点。\n我需要从提供的文本中提取关键信息：\n1.  **项目名称：** OpenClaw。\n2.  **核心身份：** 个人AI助手，在你自己的设备上运行。\n3.  **关键功能1（平台/操作系统）：** 任何操作系统，任何平台。支持macOS/iOS/Android（语音/听写），Linux，Windows（通过WSL2）。\n4.  **关键功能2（集成）：** 可在你已使用的频道上回答。支持广泛的列表（WhatsApp, Telegram, Slack, Discord, WeChat, QQ等）。\n5.  **关键功能3（界面）：** 可渲染由你控制的实时Canvas。\n6.  **特点：** 个人化，单用户，感觉本地、快速且始终在线。网关只是控制平面。\n7.  **设置：** CLI设置向导（`openclaw onboard`）。\n\n起草摘要（中文）：\nOpenClaw 是一款运行在个人设备上的私人 AI 助手，支持跨平台使用（macOS、Linux、Windows 等）。它能集成 WhatsApp、Telegram、微信、QQ 等多种通讯频道，在你现有的聊天界面中响应请求。OpenClaw 支持语音交互，并提供实时 Canvas 可控渲染。该项目旨在提供一种本地化、快速且始终在线的单用户 AI 体验，通过 CLI 向导即可轻松完成网关、工作区和技能的部署配置。\n\n检查字数：\n草稿大约 140 个字。这完全符合 50-200 字的范围。\n\n优化流畅度和影响力：\nOpenClaw 是一款运行在个人设备上的私人 AI 助手，支持全平台使用。它能无缝集成 WhatsApp、Telegram、微信、QQ 等多种通讯渠道，在你现有的聊天界面中提供即时响应。该项目支持语音交互，并具备实时 Canvas 渲染功能。OpenClaw 旨在打造本地化、快速且始终在线的单用户 AI 体验，通过简单的 CLI 向导即可轻松完成部署与配置。\n\n字数检查：约 135 个字。完美。\n\n最终润色：\nOpenClaw 是一款运行在个人设备上的私人 AI 助手，支持跨平台使用。它能无缝集成 WhatsApp、Telegram、微信、QQ 等多种通讯渠道，在你现有的聊天界面"
    },
    {
      "title": "n8n",
      "url": "https://github.com/n8n-io/n8n",
      "popularity": 184909,
      "popularity_type": "total_stars",
      "author": "n8n-io",
      "created_at": "2019-06-22T17:24:21+08:00",
      "updated_at": "2026-04-21T12:32:22+08:00",
      "language": "TypeScript",
      "topics": [
        "ai",
        "apis",
        "automation",
        "cli",
        "data-flow",
        "development",
        "integration-framework",
        "integrations",
        "ipaas",
        "low-code",
        "low-code-platform",
        "mcp",
        "mcp-client",
        "mcp-server",
        "n8n",
        "no-code",
        "self-hosted",
        "typescript",
        "workflow",
        "workflow-automation"
      ],
      "summary": "1. **分析请求：**\n    *   **源材料：** 项目名称“n8n”，项目描述，以及 README 的前 3000 字（包含功能、快速开始、资源、支持、许可证、贡献、加入团队、名称含义）。\n    *   **目标：** 用中文写一个项目摘要。\n    *   **长度限制：** 50-200 字。\n    *   **重点：** 项目功能和特点。\n    *   **输出格式：** 仅直接输出，无前缀/后缀。\n\n2.  **提取关键信息：**\n    *   *它是什么？* 工作流自动化平台。\n    *   *目标受众：* 技术团队。\n    *   *核心功能：*\n        *   可视化构建与自定义代码（JavaScript/Python）相结合。\n        *   原生 AI 能力（基于 LangChain 的 AI 代理工作流）。\n        *   400+ 集成。\n        *   900+ 模板。\n    *   *部署/控制：* 自托管或云，数据完全控制，企业级（SSO，权限）。\n    *   *许可证：* 公平代码（可持续使用许可证）。\n\n3.  **起草 - 尝试 1（构思大纲）：**\n    n8n 是一个面向技术团队的工作流自动化平台。它结合了可视化的速度和代码的灵活性。支持 400 多种集成和原生 AI 功能，可以基于 LangChain 构建 AI 代理工作流。用户可以选择自托管或使用云服务，保持对数据的完全控制。它采用公平代码许可证，适合企业使用，提供高级权限和 SSO 功能。\n\n4.  **润色与压缩（关注字数和重点）：**\n    *   *草稿：* n8n 是一款面向技术团队的工作流自动化平台，兼具可视化构建的便捷与自定义代码的灵活性。它拥有原生 AI 能力，支持基于 LangChain 构建 AI 代理工作流，并提供 400 多种集成与 900 多个模板。用户可选择自托管或云部署，完全掌控数据。该平台采用公平代码许可证，具备企业级权限管理和 SSO 功能，适合安全要求高的自动化场景。\n\n5.  **字数检查（草稿 2）：**\n    n8n 是一款面向技术团队的工作流自动化平台，兼具"
    },
    {
      "title": "AutoGPT",
      "url": "https://github.com/Significant-Gravitas/AutoGPT",
      "popularity": 183617,
      "popularity_type": "total_stars",
      "author": "Significant-Gravitas",
      "created_at": "2023-03-16T17:21:07+08:00",
      "updated_at": "2026-04-21T12:27:03+08:00",
      "language": "Python",
      "topics": [
        "agentic-ai",
        "agents",
        "ai",
        "artificial-intelligence",
        "autonomous-agents",
        "claude",
        "gpt",
        "llama-api",
        "llm",
        "openai",
        "python"
      ],
      "summary": "1. **分析请求：**\n    *   **任务：** 用中文写一个项目摘要（50-200字）。\n    *   **参考资料：** 项目名称（“AutoGPT”），项目描述（关于“accessible AI”的愿景，提供工具），以及 README 的前 3000 字（包含介绍、托管选项、系统要求、安装说明）。\n    *   **重点：** 项目功能和特点。\n    *   **限制：** 直接输出，无前缀/后缀。\n\n2.  **分析源材料：**\n    *   *项目名称：* AutoGPT。\n    *   *描述：* 愿景是人人可及的 AI（使用和构建）。使命是提供工具，以便用户专注于重要的事情。\n    *   *README 介绍：* “AutoGPT is a powerful platform that allows you to create, deploy, and manage continuous AI agents that automate complex workflows.”（AutoGPT 是一个强大的平台，允许您创建、部署和管理自动化复杂工作流的持续 AI 代理。）\n    *   *托管选项：* 自托管（免费），云端托管（即将推出）。\n    *   *系统要求：* CPU 4核+，内存 8-16GB，Docker，Node.js 等。（技术细节，不太适合高层摘要，但暗示了本地部署能力）。\n    *   *设置：* 自动化脚本。\n\n3.  **识别关键功能和特点：**\n    *   **核心功能：** 创建、部署和管理 AI 代理。\n    *   **目的：** 自动化复杂工作流。\n    *   **目标：** 让 AI 对每个人都易于访问（使用和构建）。\n    *   **灵活性：** 支持自托管（免费）和云端托管。\n\n4.  **起草摘要（迭代过程）：**\n\n    *   *草稿 1（构思）：* AutoGPT是一个强大的平台，旨在让每个人都能使用和构建AI。它允许用户创建、部署和管理自动化的AI代理，从而处理复杂的工作流程。项目提供免费的自托管选项，同时也即将推出云端托管服务。通过提供必要的工具，AutoGPT帮助用户专注于重要的事情，实现AI的普及化。\n\n    *   *字数检查（草稿 1）：* 约120字。长度合适。\n\n    *   *针对流畅度和影响力进行润色：*\n        Auto"
    },
    {
      "title": "ollama",
      "url": "https://github.com/ollama/ollama",
      "popularity": 169556,
      "popularity_type": "total_stars",
      "author": "ollama",
      "created_at": "2023-06-27T03:39:32+08:00",
      "updated_at": "2026-04-21T12:28:35+08:00",
      "language": "Go",
      "topics": [
        "deepseek",
        "gemma",
        "gemma3",
        "glm",
        "go",
        "golang",
        "gpt-oss",
        "llama",
        "llama3",
        "llm",
        "llms",
        "minimax",
        "mistral",
        "ollama",
        "qwen"
      ],
      "summary": "1. **分析请求：**\n    *   **任务：** 用中文写一个项目摘要。\n    *   **长度：** 50-200 字。\n    *   **重点：** 项目功能和特点。\n    *   **参考资料：** 项目名称 \"ollama\"，描述（模型列表），以及 README 内容（安装、入门、集成、REST API、库、后端）。\n    *   **约束：** 仅直接输出摘要，无前缀/后缀。\n\n2.  **分析参考资料：**\n    *   *项目名称：* Ollama。\n    *   *核心功能：* 运行大语言模型（LLMs）。\n    *   *支持的模型：* Kimi-K2.5, GLM-5, MiniMax, DeepSeek, gpt-oss, Qwen, Gemma 等。\n    *   *平台：* macOS, Windows, Linux, Docker。\n    *   *功能：*\n        *   在本地运行/聊天模型（例如 `ollama run gemma3`）。\n        *   集成（Claude Code, Codex, Copilot, OpenClaw）。\n        *   REST API（用于运行/管理模型）。\n        *   库（Python, JS）。\n    *   *关键特点：* 易于安装（一键脚本），开源模型支持，跨平台，可扩展（API/库）。\n\n3.  **起草摘要（迭代过程）：**\n\n    *   *尝试 1（思维大纲）：*\n        Ollama 是一个运行大语言模型的工具。它支持 macOS, Windows 和 Linux。你可以运行像 DeepSeek 和 Qwen 这样的模型。它有一个 REST API 和 Python/JS 库。它还可以与 Codex 和 Copilot 等工具集成。\n\n    *   *尝试 2（翻译成中文并润色）：*\n        Ollama 是一个支持在本地运行多种大语言模型的项目。它兼容 macOS、Windows 和 Linux 系统，并支持 Docker 部署。用户可以轻松运行 DeepSeek、Qwen、Gemma 等开源模型。Ollama 提供 REST API 及 Python、JavaScript 库，方便开发者集成。此外，它还支持与 Claude Code、Copilot 等现有工具集成，既可作为本地 AI 助手，也支持编码辅助功能。\n\n    *   *尝试 3"
    },
    {
      "title": "everything-claude-code",
      "url": "https://github.com/affaan-m/everything-claude-code",
      "popularity": 162340,
      "popularity_type": "total_stars",
      "author": "affaan-m",
      "created_at": "2026-01-18T08:51:51+08:00",
      "updated_at": "2026-04-21T12:34:17+08:00",
      "language": "JavaScript",
      "topics": [
        "ai-agents",
        "anthropic",
        "claude",
        "claude-code",
        "developer-tools",
        "llm",
        "mcp",
        "productivity"
      ],
      "summary": "1.  **分析请求：**\n    *   **源材料：** 项目名称、项目描述以及 README 的前 3000 字（包括徽章、统计数据、简介以及“指南”部分的开始）。\n    *   **任务：** 用中文写一个项目摘要。\n    *   **长度：** 50-200 字。\n    *   **重点：** 功能和特点。\n    *   **约束：** 直接输出，无前缀/后缀。\n\n2.  **分析源材料：**\n    *   **项目名称：** everything-claude-code\n    *   **描述：** “The agent harness performance optimization system. Skills, instincts, memory, security, and research-first development for Claude Code, Codex, Opencode, Cursor and beyond.”\n    *   **README 关键点：**\n        *   “AI agent harnesses 的性能优化系统。”\n        *   “Anthropic hackathon winner”（Anthropic 黑客松获奖者）。\n        *   “Not just configs. A complete system: skills, instincts, memory optimization, continuous learning, security scanning, and research-first development.”（不仅仅是配置。一个完整的系统：技能、本能、内存优化、持续学习、安全扫描和研究优先的开发。）\n        *   “Production-ready agents, skills, hooks, rules, MCP configurations, and legacy command shims.”（生产就绪的代理、技能、钩子、规则、MCP 配置和遗留命令垫片。）\n        *   兼容性：Claude Code, Codex, Cursor, OpenCode, Gemini 等。\n        *   统计数据：高受欢迎程度（Star 数），多种语言生态系统。\n\n3.  **起草 - 尝试 1（心理翻译）：**\n    everything-claude-code 是一个 AI 代理性能优化系统，曾获 Anthropic 黑客松大奖。它不仅提供配置，还包含技能、本能、内存优化、安全扫描和研究优先开发等完整功能。该项目支持 Claude Code、Cursor、Gemini 等多种 AI 编码工具，提供生产就绪的代理、MCP 配置和命令垫片，旨在通过持续学习提升 AI 开发效率。\n\n4.  **润色和检查约束：**\n    *   *长度：* 128 字。（很好，在 50-200 之间）。\n    *   *重点：* �"
    },
    {
      "title": "superpowers",
      "url": "https://github.com/obra/superpowers",
      "popularity": 161807,
      "popularity_type": "total_stars",
      "author": "obra",
      "created_at": "2025-10-10T03:45:18+08:00",
      "updated_at": "2026-04-21T12:34:23+08:00",
      "language": "Shell",
      "topics": [],